{
  "body_markdown": "## Agentic pack \u2014 multi-agent coordination (per-prompt scores)\n\n- **metric:** `total_weighted_rubric_score`\n- **shape:** 2\u00d71 (grid)\n\n### Highlights\n\n- See the companion matrix Markdown for the full score grid.\n",
  "id": "agentic-pack-multi-agent-coordination-example-report",
  "kind": "model_comparison",
  "period_end": "1970-01-01",
  "period_start": "1970-01-01",
  "source_refs": [
    "matrices/grid.json",
    "markdown/matrix.grid.md"
  ],
  "title": "Report: Agentic pack \u2014 multi-agent coordination (per-prompt scores)"
}
