{
  "body_markdown": "## Example mixed inline + registry prompts (per-prompt scores)\n\n- **metric:** `total_weighted_rubric_score`\n- **shape:** 1\u00d72 (grid)\n\n### Highlights\n\n- See the companion matrix Markdown for the full score grid.\n",
  "id": "examples-registry-mixed-report",
  "kind": "model_comparison",
  "period_end": "1970-01-01",
  "period_start": "1970-01-01",
  "source_refs": [
    "matrices/grid.json",
    "markdown/matrix.grid.md"
  ],
  "title": "Report: Example mixed inline + registry prompts (per-prompt scores)"
}
