{
  "body_markdown": "## Browser file-runner benchmark (checkout fixture) (per-prompt scores)\n\n- **metric:** `total_weighted_rubric_score`\n- **shape:** 1\u00d71 (grid)\n\n### Highlights\n\n- See the companion matrix Markdown for the full score grid.\n",
  "id": "campaign.examples.browser_evidence_compare.v1__0000-report",
  "kind": "model_comparison",
  "period_end": "1970-01-01",
  "period_start": "1970-01-01",
  "source_refs": [
    "matrices/grid.json",
    "markdown/matrix.grid.md"
  ],
  "title": "Report: Browser file-runner benchmark (checkout fixture) (per-prompt scores)"
}
