{
  "body_markdown": "## Generous rubric \u2014 Markdown synthesis + browser evidence (dual modes) (per-prompt scores)\n\n- **metric:** `total_weighted_rubric_score`\n- **shape:** 2\u00d72 (grid)\n\n### Highlights\n\n- See the companion matrix Markdown for the full score grid.\n",
  "id": "examples-registry-generous-duo-report",
  "kind": "model_comparison",
  "period_end": "1970-01-01",
  "period_start": "1970-01-01",
  "source_refs": [
    "matrices/grid.json",
    "markdown/matrix.grid.md"
  ],
  "title": "Report: Generous rubric \u2014 Markdown synthesis + browser evidence (dual modes) (per-prompt scores)"
}
